{
  "schema_version": "capability-pack-1.0",
  "license": {
    "spdx": "MIT",
    "source": "package.json#license",
    "redistribution": "unknown",
    "components": [
      {
        "root": "00_resources/fan_robotlab/robot_lab",
        "path": "00_resources/fan_robotlab/robot_lab/LICENSE",
        "sha256": "dab01dca084ffa02bc9bb1bbfdbaf2a826a5da3ae4053d710cb1352b564bd352",
        "spdx": "Apache-2.0"
      },
      {
        "root": "00_resources/g1-mujoco-ros2-nav-sim-G1-MuJoCo-ROS2-/src/unitree_rl_mjlab",
        "path": "00_resources/g1-mujoco-ros2-nav-sim-G1-MuJoCo-ROS2-/src/unitree_rl_mjlab/LICENCE",
        "sha256": "ff28cacaef7b9919a0fb905136cf4ccffba5191522bf5d024c4339932c0edc28",
        "spdx": "Apache-2.0"
      },
      {
        "root": "00_resources/go2_rl_robotlab",
        "path": "00_resources/go2_rl_robotlab/LICENSE",
        "sha256": "6c902f2125ac13341ec3bd7a8e2a06550926b58a056a7a223172e6501370b70b",
        "spdx": "Apache-2.0"
      },
      {
        "root": "00_resources/kaiwu_rl/go2_rl_gym/legged_gym",
        "path": "00_resources/kaiwu_rl/go2_rl_gym/legged_gym/LICENSE",
        "sha256": "d5b70bfeae0eb84295cff9dd7daf71e28a809eae4a1953762d491cb256dafeb6",
        "spdx": "BSD-3-Clause"
      },
      {
        "root": "00_resources/lain_job/LLoco",
        "path": "00_resources/lain_job/LLoco/LICENSE",
        "sha256": "8ca04d9dbbccd20f0f1842fb33e13949f9e57064b150dad36af8e7a751ca3321",
        "spdx": "Apache-2.0"
      },
      {
        "root": "00_resources/robot_lab",
        "path": "00_resources/robot_lab/LICENSE",
        "sha256": "dab01dca084ffa02bc9bb1bbfdbaf2a826a5da3ae4053d710cb1352b564bd352",
        "spdx": "Apache-2.0"
      },
      {
        "root": "00_resources/uni_rl/unitree_rl_lab",
        "path": "00_resources/uni_rl/unitree_rl_lab/LICENCE",
        "sha256": "ff28cacaef7b9919a0fb905136cf4ccffba5191522bf5d024c4339932c0edc28",
        "spdx": "Apache-2.0"
      },
      {
        "root": "00_resources/uni_rl/unitree_rl_mjlab",
        "path": "00_resources/uni_rl/unitree_rl_mjlab/LICENCE",
        "sha256": "ff28cacaef7b9919a0fb905136cf4ccffba5191522bf5d024c4339932c0edc28",
        "spdx": "Apache-2.0"
      },
      {
        "root": "00_resources/unitree_rl_mjlab",
        "path": "00_resources/unitree_rl_mjlab/LICENCE",
        "sha256": "ff28cacaef7b9919a0fb905136cf4ccffba5191522bf5d024c4339932c0edc28",
        "spdx": "Apache-2.0"
      },
      {
        "root": "00_resources/unitree_rl_mjlab_go2w",
        "path": "00_resources/unitree_rl_mjlab_go2w/LICENCE",
        "sha256": "ff28cacaef7b9919a0fb905136cf4ccffba5191522bf5d024c4339932c0edc28",
        "spdx": "Apache-2.0"
      }
    ],
    "unresolved": [
      {
        "upstream": "parkour_mjlab",
        "reason": "祖先链上没有许可文件（LICENSE/COPYING）——该来源的许可未取证",
        "leads": []
      }
    ]
  },
  "pack_id": "unitree_go2-velocity",
  "display_name": "Unitree Go2 · velocity",
  "description": "默认 Pack（tools/generate_packs.py 生成）：引用该机型契约真值 与技能 velocity_base。",
  "tags": [
    "generated",
    "default",
    "quadruped_12dof"
  ],
  "morphology_ref": {
    "id": "unitree_go2",
    "path": "assets/robots/unitree_go2/contract.json",
    "sha256": "d226fdf68b135bf0b28038b6d301b2f3aac119d263a1c0919f78761d3955fc63"
  },
  "skill_ref": {
    "id": "velocity_base",
    "path": "registry/skills/velocity_base.json",
    "sha256": "872e5cca8ec5a1c79c135399b551494d09e009f94b6a8735d5cac783c1580003"
  },
  "scenario_ref": null,
  "policy_ref": null,
  "bindings": {
    "verify": {
      "require_contract_valid": true,
      "require_refs_resolved": true,
      "require_physics_consistent": false
    },
    "train": {
      "pipeline_topology": "asymmetric_ac",
      "smoke": {
        "num_envs": 64,
        "max_iterations": 5
      }
    },
    "simulate": {
      "executors": [
        "wasm",
        "server_mujoco"
      ],
      "require_deterministic_replay": true,
      "require_onnx_metadata_check": true
    },
    "deploy": {
      "denylist": [
        "observation_groups",
        "action_scale",
        "joint_order",
        "control_hz",
        "armature"
      ],
      "require_human_confirm": true
    }
  }
}
