{
  "schema_version": "capability-pack-1.0",
  "license": {
    "spdx": "MIT",
    "source": "package.json#license",
    "redistribution": "allowed",
    "components": [
      {
        "root": "00_resources/deep_rl/rl_training",
        "path": "00_resources/deep_rl/rl_training/LICENSE",
        "sha256": "a5faaa5866c9b0414a6f5fe02724e2178b4f0b07426c77b7f3beb3e05f112c94",
        "spdx": "BSD-3-Clause"
      },
      {
        "root": "00_resources/fan_robotlab/robot_lab",
        "path": "00_resources/fan_robotlab/robot_lab/LICENSE",
        "sha256": "dab01dca084ffa02bc9bb1bbfdbaf2a826a5da3ae4053d710cb1352b564bd352",
        "spdx": "Apache-2.0"
      },
      {
        "root": "00_resources/m20_rl_isaacsim",
        "path": "00_resources/m20_rl_isaacsim/LICENSE",
        "sha256": "a5faaa5866c9b0414a6f5fe02724e2178b4f0b07426c77b7f3beb3e05f112c94",
        "spdx": "BSD-3-Clause"
      },
      {
        "root": "00_resources/rl_training",
        "path": "00_resources/rl_training/LICENSE",
        "sha256": "a5faaa5866c9b0414a6f5fe02724e2178b4f0b07426c77b7f3beb3e05f112c94",
        "spdx": "BSD-3-Clause"
      },
      {
        "root": "00_resources/robot_lab",
        "path": "00_resources/robot_lab/LICENSE",
        "sha256": "dab01dca084ffa02bc9bb1bbfdbaf2a826a5da3ae4053d710cb1352b564bd352",
        "spdx": "Apache-2.0"
      }
    ],
    "unresolved": []
  },
  "pack_id": "deeprobotics_lite3-velocity",
  "display_name": "Deeprobotics Lite3 · velocity",
  "description": "默认 Pack（tools/generate_packs.py 生成）：引用该机型契约真值 与技能 velocity_base。",
  "tags": [
    "generated",
    "default",
    "quadruped_12dof"
  ],
  "morphology_ref": {
    "id": "deeprobotics_lite3",
    "path": "assets/robots/deeprobotics_lite3/contract.json",
    "sha256": "3de261b874e1576b4eb146905ee69cd8aa158645c4613d64c706cb58bba07ccc"
  },
  "skill_ref": {
    "id": "velocity_base",
    "path": "registry/skills/velocity_base.json",
    "sha256": "872e5cca8ec5a1c79c135399b551494d09e009f94b6a8735d5cac783c1580003"
  },
  "scenario_ref": null,
  "policy_ref": null,
  "bindings": {
    "verify": {
      "require_contract_valid": true,
      "require_refs_resolved": true,
      "require_physics_consistent": false
    },
    "train": {
      "pipeline_topology": "asymmetric_ac",
      "smoke": {
        "num_envs": 64,
        "max_iterations": 5
      }
    },
    "simulate": {
      "executors": [
        "wasm",
        "server_mujoco"
      ],
      "require_deterministic_replay": true,
      "require_onnx_metadata_check": true
    },
    "deploy": {
      "denylist": [
        "observation_groups",
        "action_scale",
        "joint_order",
        "control_hz",
        "armature"
      ],
      "require_human_confirm": true
    }
  }
}
