{
  "schema_version": "capability-pack-1.0",
  "license": {
    "spdx": "MIT",
    "source": "package.json#license",
    "redistribution": "allowed",
    "components": [
      {
        "root": "00_resources/fan_robotlab/robot_lab",
        "path": "00_resources/fan_robotlab/robot_lab/LICENSE",
        "sha256": "dab01dca084ffa02bc9bb1bbfdbaf2a826a5da3ae4053d710cb1352b564bd352",
        "spdx": "Apache-2.0"
      },
      {
        "root": "00_resources/robot_lab",
        "path": "00_resources/robot_lab/LICENSE",
        "sha256": "dab01dca084ffa02bc9bb1bbfdbaf2a826a5da3ae4053d710cb1352b564bd352",
        "spdx": "Apache-2.0"
      },
      {
        "root": "00_resources/unitree_rl_mjlab",
        "path": "00_resources/unitree_rl_mjlab/LICENCE",
        "sha256": "ff28cacaef7b9919a0fb905136cf4ccffba5191522bf5d024c4339932c0edc28",
        "spdx": "Apache-2.0"
      },
      {
        "root": "00_resources/unitree_rl_mjlab_go2w",
        "path": "00_resources/unitree_rl_mjlab_go2w/LICENCE",
        "sha256": "ff28cacaef7b9919a0fb905136cf4ccffba5191522bf5d024c4339932c0edc28",
        "spdx": "Apache-2.0"
      }
    ],
    "unresolved": []
  },
  "pack_id": "unitree_go2w-velocity",
  "display_name": "Unitree Go2-W · velocity",
  "description": "默认 Pack（tools/generate_packs.py 生成）：引用该机型契约真值 与技能 velocity_base。",
  "tags": [
    "generated",
    "default",
    "wheel_leg_16dof"
  ],
  "morphology_ref": {
    "id": "unitree_go2w",
    "path": "assets/robots/unitree_go2w/contract.json",
    "sha256": "4d487619f79651be2087bd305edcff405632510073c1a6563b2425b400c76f94"
  },
  "skill_ref": {
    "id": "velocity_base",
    "path": "registry/skills/velocity_base.json",
    "sha256": "872e5cca8ec5a1c79c135399b551494d09e009f94b6a8735d5cac783c1580003"
  },
  "scenario_ref": null,
  "policy_ref": {
    "id": "unitree_go2w__produced-unitree_go2w_contract_v1_20261002_200555_756620",
    "path": "simulation/policies/unitree_go2w-trained-20261002-200555.onnx",
    "sha256": "d1ec37a2f889e650a8325104ca69ee49899a6c9d9f44d981865a7a0336f13b4b",
    "version": "unitree_go2w-trained-20261002-200555"
  },
  "bindings": {
    "verify": {
      "require_contract_valid": true,
      "require_refs_resolved": true,
      "require_physics_consistent": false
    },
    "train": {
      "pipeline_topology": "asymmetric_ac",
      "smoke": {
        "num_envs": 64,
        "max_iterations": 5
      }
    },
    "simulate": {
      "executors": [
        "wasm",
        "server_mujoco"
      ],
      "require_deterministic_replay": true,
      "require_onnx_metadata_check": true
    },
    "deploy": {
      "denylist": [
        "observation_groups",
        "action_scale",
        "joint_order",
        "control_hz",
        "armature"
      ],
      "require_human_confirm": true
    }
  }
}
