{
  "schema_version": "capability-pack-1.0",
  "license": {
    "spdx": "MIT",
    "source": "package.json#license",
    "redistribution": "allowed",
    "components": [
      {
        "root": "00_resources/fan_robotlab/robot_lab",
        "path": "00_resources/fan_robotlab/robot_lab/LICENSE",
        "sha256": "dab01dca084ffa02bc9bb1bbfdbaf2a826a5da3ae4053d710cb1352b564bd352",
        "spdx": "Apache-2.0"
      },
      {
        "root": "00_resources/robot_lab",
        "path": "00_resources/robot_lab/LICENSE",
        "sha256": "dab01dca084ffa02bc9bb1bbfdbaf2a826a5da3ae4053d710cb1352b564bd352",
        "spdx": "Apache-2.0"
      }
    ],
    "unresolved": []
  },
  "pack_id": "unitree_b2w-velocity",
  "display_name": "Unitree B2-W · velocity",
  "description": "默认 Pack（tools/generate_packs.py 生成）：引用该机型契约真值 与技能 velocity_base。",
  "tags": [
    "generated",
    "default",
    "wheel_leg_16dof"
  ],
  "morphology_ref": {
    "id": "unitree_b2w",
    "path": "assets/robots/unitree_b2w/contract.json",
    "sha256": "9266a710a6d390e9b5ab6548cea91c6c6b54faf3554f638bb185ac81c23abe9c"
  },
  "skill_ref": {
    "id": "velocity_base",
    "path": "registry/skills/velocity_base.json",
    "sha256": "872e5cca8ec5a1c79c135399b551494d09e009f94b6a8735d5cac783c1580003"
  },
  "scenario_ref": null,
  "policy_ref": null,
  "bindings": {
    "verify": {
      "require_contract_valid": true,
      "require_refs_resolved": true,
      "require_physics_consistent": false
    },
    "train": {
      "pipeline_topology": "asymmetric_ac",
      "smoke": {
        "num_envs": 64,
        "max_iterations": 5
      }
    },
    "simulate": {
      "executors": [
        "wasm",
        "server_mujoco"
      ],
      "require_deterministic_replay": true,
      "require_onnx_metadata_check": true
    },
    "deploy": {
      "denylist": [
        "observation_groups",
        "action_scale",
        "joint_order",
        "control_hz",
        "armature"
      ],
      "require_human_confirm": true
    }
  }
}
