{
  "schema_version": "capability-pack-1.0",
  "license": {
    "spdx": "MIT",
    "source": "package.json#license",
    "redistribution": "unknown",
    "components": [],
    "unresolved": [
      {
        "upstream": "rc_old",
        "reason": "祖先链上没有许可文件（LICENSE/COPYING）——该来源的许可未取证",
        "leads": []
      }
    ]
  },
  "pack_id": "zex-w-velocity",
  "display_name": "ZEX-W · velocity",
  "description": "默认 Pack（tools/generate_packs.py 生成）：引用该机型契约真值 与技能 velocity_base。",
  "tags": [
    "generated",
    "default",
    "wheel_leg_16dof"
  ],
  "morphology_ref": {
    "id": "zex-w",
    "path": "assets/robots/zex-w/contract.json",
    "sha256": "a4b25645fb46c10bedfcd383c6c776106bd4d8882b488bfeb77b90ba83aa6b45"
  },
  "skill_ref": {
    "id": "velocity_base",
    "path": "registry/skills/velocity_base.json",
    "sha256": "872e5cca8ec5a1c79c135399b551494d09e009f94b6a8735d5cac783c1580003"
  },
  "scenario_ref": null,
  "policy_ref": null,
  "bindings": {
    "verify": {
      "require_contract_valid": true,
      "require_refs_resolved": true,
      "require_physics_consistent": false
    },
    "train": {
      "pipeline_topology": "asymmetric_ac",
      "smoke": {
        "num_envs": 64,
        "max_iterations": 5
      }
    },
    "simulate": {
      "executors": [
        "wasm",
        "server_mujoco"
      ],
      "require_deterministic_replay": true,
      "require_onnx_metadata_check": true
    },
    "deploy": {
      "denylist": [
        "observation_groups",
        "action_scale",
        "joint_order",
        "control_hz",
        "armature"
      ],
      "require_human_confirm": true
    }
  }
}
