{
  "schema_version": "capability-pack-1.0",
  "pack_id": "limx_tron1_sf-velocity",
  "display_name": "LimX Tron1 SF · velocity",
  "description": "默认 Pack（tools/generate_packs.py 生成）：引用该机型契约 v3 与 core/velocity@2.0。",
  "tags": [
    "generated",
    "default",
    "biped"
  ],
  "morphology_ref": {
    "id": "limx_tron1_sf",
    "path": "assets/robots/limx_tron1_sf/contract_v3.json",
    "sha256": "6a39abff236fae569e960fdf81cc2373c9788518764f1701343e6395d77b10a6"
  },
  "skill_ref": {
    "id": "core/velocity@2.0",
    "version": "2.0"
  },
  "scenario_ref": null,
  "policy_ref": null,
  "bindings": {
    "verify": {
      "require_contract_valid": true,
      "require_refs_resolved": true,
      "require_physics_consistent": false
    },
    "train": {
      "pipeline_topology": "asymmetric_ac",
      "smoke": {
        "num_envs": 64,
        "max_iterations": 5
      }
    },
    "simulate": {
      "executors": [
        "wasm",
        "server_mujoco"
      ],
      "require_deterministic_replay": true,
      "require_onnx_metadata_check": true
    },
    "deploy": {
      "denylist": [
        "observation_groups",
        "action_scale",
        "joint_order",
        "control_hz",
        "armature"
      ],
      "require_human_confirm": true
    }
  }
}
